<?xml version="1.0" encoding="UTF-8"?>
<metamorph xmlns="http://www.culturegraph.org/metamorph"
	xmlns:xsi="http://www.w3.org/2001/XMLSchema-instance"
	xsi:schemaLocation="
		http://www.culturegraph.org/metamorph metamorph.xsd" entityMarker=".">

	<name>Umsetzung Title</name>

	<data source="003@.0" name="cg:sourceRecordId" />
	
	<data source="001B.0" name="dcterms:modified" />
		
	<data source="013H.0" name="dcterms:format">
	</data>
	
	<data source="010@.a" name="dcterms:language"/>
	
	<data source="019@a" name="cg:countryCodeIso" />
	
	<group name="dcterms:issued">
		<data source="011@.a" />
		<data source="011@.n" />
	</group>
	
	<data source="010@.c" name="xbib:originLanguage"/>
	
	<data source="006A.0" name="xbib:identifierAuthorityLOC" />
	
	<data source="006Y.0" name="xbib:identifierPatent" />
	
	<data source="006G.0" name="xbib:identifierAuthorityDNB" />
	
	<data source="006B.0" name="xbib:identifierAuthorityBNB" />
	
	<data source="006Z.0" name="xbib:identifierAuthorityZDB" />
	
	<data source="006X.0" name="xbib:identifierAuthorityCasaliniLibri" />
	<data source="006X.2" name="xbib:identifierAuthorityCasaliniLibri" />
	
	<data source="006A.0" name="xbib:identifierAuthorityLOC" />
	
	<data source="006X.2" name="xbib:identifierAuthorityCasaliniLibri" />
	
	<collect-literal name="xbib:identifierAuthorityEKI"
		value="${prefix}${id}">
		<data source="007G.a" name="prefix" />
		<data source="007G.0" name="id"/>
	</collect-literal>	
				
	<data source="007Ha.0" name="xbib:identifierRegioKOBV" />
	<data source="007Hd.0" name="xbib:identifierRegioHBZ" />
	<data source="007He.0" name="xbib:identifierRegioHEBIS" />
	<data source="007Hf.0" name="xbib:identifierRegioBSZ" />
	<data source="007Hg.0" name="xbib:identifierRegioBVB" />
	<data source="007Hh.0" name="xbib:identifierRegioGBV" />
			
	<data source="007Ib.0" name="xbib:identifierAuthorityBNB" />
	<data source="007Ic.0" name="xbib:identifierAuthorityCasaliniLibri" />
	<data source="007Ie.0" name="xbib:identifierAuthorityEKZ" />
	<data source="007Ig.0" name="xbib:identifierAuthorityBNF" />
	<data source="007Il.0" name="xbib:identifierAuthorityLOC" />
	<data source="007Io.0" name="xbib:identifierAuthorityOCLC" />
		
	<data source="004A.0" name="xbib:identifierAuthorityISBN">
		<isbn to="isbn13" />
	</data>
	
	<data source="005A.0" name="xbib:identifierAuthorityISSN" />
	
	<data source="004F.0" name="xbib:identifierAuthorityISMN" />
	
	<data source="004M.0" name="xbib:identifierAuthorityISRN" />
	
	<data source="004L.0" name="xbib:identifierAuthorityEAN" />
	
	<data source="004V.0" name="xbib:uniformResourceDoi" />
	
	<data source="004U.0" name="xbib:uniformResourceName" />
	
	<data source="004R.0" name="xbib:uniformResourceHandle" />
	
	<data source="007E.0" name="xbib:identifierUniversityScript"/>
	
	<data source="006W.0" name="xbib:identifierVD18"/>
	
	<data source="006V.0" name="xbib:identifierVD16"/>
	
	<data source="006R.0" name="xbib:identifierVD17"/>
	
	<data source="007P.0" name="xbib:fingerprint"/>
	
	<group name="xbib:creatorDNBGND">
		<data source="028A.9" />
		<data source="028A.7" />
	</group>
		
	<collect-literal name="dcterms:creator"
		value="${surname}${forename}${prefix}${personalname}${qualifier}"
		forceOnEnd="028A">
		<data source="028A.a" name="surname" />
		<data source="028A.d" name="forename">
			<compose prefix=", " />
		</data>
		<data source="028A.c" name="prefix">
			<compose prefix=" " />
		</data>
		<data source="028A.l" name="qualifier">
			<compose prefix=" &lt;" postfix="&gt;" />
		</data>
		<data source="028A.5" name="personalname" />
	</collect-literal>
	
	<group name="rdaGr2:identifierForTheCorporateBody">
		<data source="029A.9" />
		<data source="029A.0" />
	</group>

	<group name="gnd:preferredNameForTheCorporateBody">
		<data source="029A.a" />
		<data source="029A.b" />
	</group>
	
	<group name="dcterms:title">
		<data source="021A.a" />
	</group>
	
	<group name="xbib:issueType">
		<data source="032@.a" />
	</group>
	
	
	<data source="002@.0" name="cg:typeOfWork">
	<substring start="1" end="2"/>
		<lookup in="workList" />
	</data>
	
	<data source="002@.0" name="cg:statusWork">
	<substring start="2" end="3"/>
		<lookup in="statusList" />
	</data>
					
	<data source="033A.p" name="xbib:publicationPlace" />
	<data source="033A.n" name="xbib:publisherName" />
	
	<map name="workList">
		<entry name="a" value="independentWork" />
		<entry name="b" value="journalSeriesNewspaper" />
		<entry name="c" value="severalVolumesWorkLimited" />
		<entry name="d" value="journalSeriesNewspaper" />
		<entry name="E" value="severalVolWorkLtdPartOfBigger " />
		<entry name="f" value="dependentConWork" />
		<entry name="F" value="singleVolumeWorkPartOfBigger" />
		<entry name="l" value="journalSeriesNewspaper" />
		<entry name="p" value="journalSeriesNewspaper" />
	</map>
	
		<map name="statusList">
		<entry name="a" value="provisorischerDatensatz" />
		<entry name="c" value="DatensatzNeuerscheinungsdienst" />
		<entry name="d" value="HssReiheH" />
		<entry name="f" value="Fremddaten" />
		<entry name="g" value="konvDatensHss " />
		<entry name="h" value="konvZeitschriftenDaten" />
		<entry name="l" value="konvDaten" />
		<entry name="r" value="konvDaten" />
		<entry name="s" value="konvDaten" />
		<entry name="n" value="altDaten" />
		<entry name="o" value="altDaten" />
		<entry name="t" value="altDaten" />
	</map>
	
</metamorph>
