<?xml version="1.0" encoding="UTF-8"?>
<metamorph xmlns="http://www.culturegraph.org/metamorph"
	xmlns:xsi="http://www.w3.org/2001/XMLSchema-instance"
	xsi:schemaLocation="
		http://www.culturegraph.org/metamorph metamorph.xsd">

	<name>Marc21 to PropertyRecord</name>
	<annotation></annotation>

    <data source="001" name="cg:sourceRecordId" ></data>
	
	<data source="0167 .2" name="xbib:identifierAuthority" />
	<data source="0167 .a" name="xbib:identifierAuthority" />
	
	<data source="010  .a" name="xbib:identifierAuthorityLOC" />
	<data source="035  .a" name="xbib:identifierAuthorityEKI" />
	<data source="0242 .a" name="xbib:identifierAuthorityISMN" />
	<data source="022  .a" name="xbib:identifierAuthorityISSN" />
	<data source="027  .a" name="xbib:identifierAuthorityISRN" />
	
	 	 	
	<data source="020  .a" name="xbib:identifierAuthorityISBN">
		<isbn to="clean" />
	</data>

</metamorph>	

