<?xml version="1.0" encoding="UTF-8"?>
<metamorph xmlns="http://www.culturegraph.org/metamorph"
	xmlns:xsi="http://www.w3.org/2001/XMLSchema-instance"
	xsi:schemaLocation="
		http://www.culturegraph.org/metamorph metamorph.xsd"
	entityMarker=".">

	<name>PicaPlus to PropertyRecord</name>
	

	<data source="002@.0" name="cg:modeOfIssuance">
		<substring start="1" end="2" />
		<lookup in="workList" />
	</data>

	<data source="002@.0" name="dcterms:format">
		<substring start="0" end="1" />
		<lookup in="material" />
	</data>

	<data source="003@.0" name="cg:sourceRecordId" />

	<data source="004A.0" name="bibo:isbn">
		<isbn to="isbn13" />
	</data>

	<data source="004F.0" name="cg:idISMN" />

	<data source="004K.0" name="bibo:gtin14 " />

	<data source="004M.0" name="cg:isrn" />

	<data source="004P.0" name="bibo:doi" />

	<data source="004U.0" name="cg:uniformResourceName" />

	<data source="004R.0" name="bibo:handle" />

	<data source="005I.0" name="bibo:issn" />
	

	<group name="cg:dnb">
		<data source="006Y.0" />
		<data source="003@.0" />
	</group>

	<data source="006Z.0" name="cg:zdb" />
<!--  
	<data source="006Y.0" name="xbib:identifierPatent" />
	
	<data source="006W.0" name="xbib:identifierVD18" />

	<data source="006V.0" name="xbib:identifierVD16" />

	<data source="006R.0" name="xbib:identifierVD17" />
-->
	<collect-literal name="cg:eki"
		value="${prefix}${id}">
		<data source="007G.a" name="prefix" />
		<data source="007G.0" name="id" />
	</collect-literal>

	<data source="007Ha.0" name="cg:idRegioKOBV" />
	<data source="007Hd.0" name="cg:idRegioHBZ" />
	<data source="007He.0" name="cg:idRegioHEBIS" />
	<data source="007Hf.0" name="cg:idRegioBSZ" />
	<data source="007Hg.0" name="cg:idRegioBVB" />
	<data source="007Hh.0" name="cg:idRegioGBV" />

	<data source="007Ib.0" name="cg:bnb" />
	<data source="007Ic.0" name="cg:casalini" />
	<data source="007Ie.0" name="cg:ekz" />
	<data source="007Ig.0" name="cg:bnf" />
	<data source="007Il.0" name="cg:loc" />
	<data source="007Io.0" name="cg:oclc" />

	<data source="007E.0" name="cg:idUniversityScript" />

	<!--  <data source="007P.0" name="xbib:fingerprint" /> -->

	<data source="010@.a" name="dcterms:language" />

	<data source="010@.c" name="cg:originLanguage" />

	<group name="dcterms:issued">
		<data source="011@.a" />
		<data source="011@.n" />
	</group>

	<!--  <data source="013H.0" name="dcterms:format">	</data> -->

	<data source="019@a" name="cg:countryCodeIso" />

	<group name="@dcterms:title">
		<data source="021A.a" />
		<data source="021B.a" />
	</group>

	<data source="@dcterms:title" name="dcterms:title">
		<normalize-utf8 />
	</data>

	<group name="@cg:additionToTitle">
		<data source="021A.d" />
		<data source="021B.d" />
	</group>

	<data source="@cg:additionToTitle" name="cg:additionToTitle">
		<normalize-utf8 />
	</data>


	<data source="021A.9" name="cg:broaderWorkId" />

	<data source="021B.l" name="bibo:volume" />

	<data source="032@.a" name="cg:edition" />

	<group name="cg:creatorDNBGND">
		<data source="028A.9" />
		<data source="028A.7" />
	</group>

	<collect-literal name="dcterms:creator"
		value="${surname}${forename}${prefix}${personalname}${qualifier}"
		forceOnEnd="028A">
		<data source="028A.a" name="surname" />
		<data source="028A.d" name="forename">
			<compose prefix=", " />
		</data>
		<data source="028A.c" name="prefix">
			<compose prefix=" " />
		</data>
		<data source="028A.l" name="qualifier">
			<compose prefix=" &lt;" postfix="&gt;" />
		</data>
		<data source="028A.5" name="personalname" />
	</collect-literal>

	<group name="rdaGr2:identifierForTheCorporateBody">
		<data source="029A.0" />
	</group>

	<group name="cg:identifierForTheSecondaryCorporateBody">
		<data source="029F.0" />
	</group>

	<group name="gnd:preferredNameForTheCorporateBody">
		<data source="029A.a" />
		<data source="029A.b" />
	</group>

	<data source="033A.p" name="cg:publicationPlace" />
	<data source="033A.n" name="dc:publisher" />

	<data source="034D.a" name="dcterms:extent" />
	
	<group name="dcterms:isPartOf">
		<data source="021A.9" />
		<data source="036D.9" />
		<data source="036F.9" />
		<data source="039B.9" />
		<data source="039C.9" />
	</group>
	
	<data source="034D.9" name="dc:isFormatOf" />
	
	<map name="workList">
		<entry name="a" value="bibo:Document" />
		<entry name="b" value="bibo:Periodical" /> 
		<entry name="c" value="bibo:Collection" />
		<entry name="d" value="bibo:Series" />
		<entry name="E" value="bibo:Collection" />
		<entry name="F" value="bibo:Document" />
		<entry name="f" value="bibo:Document" /> 
		<entry name="l" value="bibo:Periodical" />
	</map>
	
	<map name="material">
		<entry name="A" value="print" />
		<entry name="B" value="audiovisual" />
		<entry name="C" value="brailles" />
		<entry name="E" value="microfiches" />
		<entry name="K" value="maps" />
		<entry name="O" value="online" />
		<entry name="S" value="discs" />
		<entry name="Z" value="multimedia" />
	</map>
	<!-- <map name="statusList"> <entry name="a" value="provisorischerDatensatz" 
		/> <entry name="c" value="DatensatzNeuerscheinungsdienst" /> <entry name="d" 
		value="HssReiheH" /> <entry name="f" value="Fremddaten" /> <entry name="g" 
		value="konvDatensHss " /> <entry name="h" value="konvZeitschriftenDaten" 
		/> <entry name="l" value="konvDaten" /> <entry name="r" value="konvDaten" 
		/> <entry name="s" value="konvDaten" /> <entry name="n" value="altDaten" 
		/> <entry name="o" value="altDaten" /> <entry name="t" value="altDaten" /> 
		</map> -->

</metamorph>
