<?xml version="1.0" encoding="UTF-8"?>
<metamorph xmlns="http://www.culturegraph.org/metamorph"
	xmlns:xsi="http://www.w3.org/2001/XMLSchema-instance"
	xsi:schemaLocation="
		http://www.culturegraph.org/metamorph metamorph.xsd" entityMarker=".">

	<name>Umsetzung Title</name>

	<data source="003@.0" name="cg:sourceRecordId" />
	
	<data source="001B.0" name="dcterms:modified" />
		
	<data source="013H.0" name="dcterms:format">
	</data>
	
	<data source="010@.a" name="dcterms:language"/>
	
	<data source="019@a" name="cg:countryCodeIso" />
	
	<data source="011@.a" name="dcterms:issued"/>
	
	<data source="010@.c" name="xbib:originLanguage"/>
	
	<data source="006A.0" name="xbib:identifierAuthorityLOC" />
	
	<data source="006Y.0" name="xbib:identifierPatent" />
	
	<data source="006G.0" name="xbib:identifierAuthorityDNB" />
	
	<data source="006B.0" name="xbib:identifierAuthorityBNB" />
	
	<data source="006Z.0" name="xbib:identifierAuthorityZDB" />
	
	<data source="006X.0" name="xbib:identifierAuthorityCasaliniLibri" />
	<data source="006X.2" name="xbib:identifierAuthorityCasaliniLibri" />
	
	<data source="006A.0" name="xbib:identifierAuthorityLOC" />
	
	<data source="006X.2" name="xbib:identifierAuthorityCasaliniLibri" />
	
	<data source="007Ga.0" name="xbib:identifierRegioKOBV" />
			
	<data source="007Ha.0" name="xbib:identifierRegioKOBV" />
	<data source="007Hd.0" name="xbib:identifierRegioHBZ" />
	<data source="007He.0" name="xbib:identifierRegioHEBIS" />
	<data source="007Hf.0" name="xbib:identifierRegioBSZ" />
	<data source="007Hg.0" name="xbib:identifierRegioBVB" />
	<data source="007Hh.0" name="xbib:identifierRegioGBV" />
			
	<data source="007Ib.0" name="xbib:identifierAuthorityBNB" />
	<data source="007Ic.0" name="xbib:identifierAuthorityCasaliniLibri" />
	<data source="007Ie.0" name="xbib:identifierAuthorityEKZ" />
	<data source="007Ig.0" name="xbib:identifierAuthorityBNF" />
	<data source="007Il.0" name="xbib:identifierAuthorityLOC" />
	<data source="007Io.0" name="xbib:identifierAuthorityOCLC" />
		
	<data source="004A.0" name="xbib:identifierAuthorityISBN">
		<isbn to="isbn13" />
	</data>
	
	<data source="005A.0" name="xbib:identifierAuthorityISSN" />
	
	<data source="004F.0" name="xbib:identifierAuthorityISMN" />
	
	<data source="004M.0" name="xbib:identifierAuthorityISRN" />
	
	<data source="004L.0" name="xbib:identifierAuthorityEAN" />
	
	<data source="004V.0" name="xbib:uniformResourceDoi" />
	
	<data source="004U.0" name="xbib:uniformResourceName" />
	
	<data source="004R.0" name="xbib:uniformResourceHandle" />
	
	<data source="007E.0" name="xbib:identifierUniversityScript"/>
	
	<data source="006W.0" name="xbib:identifierVD18"/>
	
	<data source="006V.0" name="xbib:identifierVD16"/>
	
	<data source="006R.0" name="xbib:identifierVD17"/>
	
	<data source="007P.0" name="xbib:fingerprint"/>
	
	
</metamorph>
