<?xml version="1.0" encoding="UTF-8"?>
<metamorph xmlns="http://www.culturegraph.org/metamorph"
	xmlns:xsi="http://www.w3.org/2001/XMLSchema-instance"
	xsi:schemaLocation="
		http://www.culturegraph.org/metamorph metamorph.xsd"
	entityMarker=".">

	<name>Umsetzung der PND</name>


	<group name="http://RDVocab.info/ElementsGr2/identifierForThePerson">
		<data source="007Q.0">
			<compose prefix="(DE-588c)" />
		</data>
		<data source="007T.0">
			<compose prefix="(DLC)" />
		</data>
		<data source="003@.0">
			<compose prefix="(DE-588a)" />
		</data>
	</group>

	<group name="http://d-nb.info/gnd/invalidIdentifierForThePerson">
		<data source="007G.0" />
		<data source="007Hm.0">
			<compose prefix="(DE-101c)" />
		</data>
	</group>

	<collect-entity name="http://d-nb.info/gnd/variantNameForThePerson"
		forceOnEnd="028A">
		<data name="http://d-nb.info/gnd/personalName" source="028A.5" />
		<data name="http://d-nb.info/gnd/surname" source="028A.a" />
		<data name="http://d-nb.info/gnd/forename" source="028A.d" />
		<data name="http://d-nb.info/gnd/prefix" source="028A.c" />
		<data name="http://d-nb.info/gnd/qualifier" source="028A.l" />
	</collect-entity>


	<collect-literal name="http://d-nb.info/gnd/variantNameForThePerson"
		value="${surname}${forename}${prefix}${personalname}${qualifier}"
		forceOnEnd="028A">
		<data source="028A.a" name="surname" />
		<data source="028A.d" name="forename">
			<compose prefix=", " />
		</data>
		<data source="028A.c" name="prefix">
			<compose prefix=" " />
		</data>
		<data source="028A.l" name="qualifier">
			<compose prefix=" &lt;" postfix="&gt;" />
		</data>
		<data source="028A.5" name="personalname" />
	</collect-literal>

	<data name="http://RDVocab.info/ElementsGr2/dateOfBirth" source="032Aa.a">
		<replace pattern=" " with="" />
		<regexp match="((\d*?))-" format="${1}" />
	</data>

	<data name="http://RDVocab.info/ElementsGr2/dateOfDeath" source="032Aa.a">
		<replace pattern=" " with="" />
		<regexp match="-((\d*?))$" format="${1}" />
	</data>

	<group name="http://RDVocab.info/ElementsGr2/periodOfActivityOfThePerson">
		<data source="032Ab.a" />
		<data source="032Ac.a" />
		<data source="032Ae.a" />
	</group>


	<data source="032Ba.a" name="http://RDVocab.info/ElementsGr2/placeOfBirth" />
	<data source="032Bd.a" name="http://RDVocab.info/ElementsGr2/placeOfDeath" />
	<group name="http://RDVocab.info/ElementsGr2/placeOfResidence">
		<data source="032Be.a" />
		<data source="032Bf.a" />
	</group>
	<data source="032Bq.a" name="http://RDVocab.info/ElementsGr2/titleOfThePerson" />
	<data source="032Bt.a" name="http://d-nb.info/gnd/academicTitleOfThePerson" />
	<data source="032Bu.a"
		name="http://RDVocab.info/ElementsGr2/biographicalInformation" />
	<data source="032Bw.a" name="http://RDVocab.info/ElementsGr2/gender" />
	<data source="032Bz.a" name="http://d-nb.info/gnd/studyPathsOfThePerson" />

	<data source="032Fa.9"
		name="http://RDVocab.info/ElementsGr2/professionOrOccupation">
		<compose prefix="http://d-nb.info/gnd/" />
	</data>

	<data name="rdaRelGr2:relatedCorporateBodyPerson" source="038C.9" />
	<data name="http://xmlns.com/foaf/0.1/homepage " source="009Q.u" />
	<data name="http://d-nb.info/gnd/countryCodeForThePerson" source="042B.a" />
	<data name="http://RDVocab.info/ElementsGr2/languageOfThePerson"
		source="042C.a" />
	<data name="http://www.w3.org/2002/07/owl#sameAs" source="039I.9" />
	<data name="http://d-nb.info/gnd/publicationOfThePerson" source="046G.a" />

	<map name="namespaces">
		<entry name="gnd" value="http://d-nb.info/gnd/" />
		<entry name="rdaGr2" value="http://RDVocab.info/ElementsGr2/" />
		<entry name="foaf" value="http://xmlns.com/foaf/0.1/" />
		<entry name="owl" value="http://www.w3.org/2002/07/owl#" />
	</map>

</metamorph>
